OBJECTID,HERITAGENR,PARLOCATIO,STREETNR,STREETNAME,STREETTYPE,ADDRESS2,SUBURB,DETAILS,HERITAGECL,HERITAGE_1,HERITAGE_2,HERITAGE_3,LHPCLASSTY,LGADESC,SHRCODE,COUNCILREF,CODE,IDCODE,AS2482,AS2482DESC,LOCATIONAC,ACCURACYDE,SOURCEOFDA,INTERIMDAT,INTERIMPAR,AUTHORISAT,AUTHPARREF,POLYGONTYP,POLYGONT_1,LOCALITY,SECTION23S,SECTION16S,PLANPARCEL,VALUATIONS,DEVPLANDES,UNITNR,SHRSTATUSC,SHRSTATUSD,EXTENTOFLI,SIGNIFICAN
246428,1674,10-14 St Johns Street ADELAIDE,10-14,St Johns Street,,,ADELAIDE,St John's Church Hall and Rectory,S,State,,,,Adelaide,16174,,1674,H0201674,15500,Religious Building,H,high level confidence,SHB,,,,,B,Building footprint,ADELAIDE,,E,CT 5845/619 F182303 A651,"0209140004, 0209140047",ADELAIDE Council,,REG,11/12/1997,,"The parish of St John's was initiated in 1839.  The original St John's Church was the second Anglican church erected in Adelaide.  The present building, which replaced the original building last century, is also a State Heritage Place. St John's Hall and"
244441,1365,221 Wakefield Street ADELAIDE,221,Wakefield Street,,,ADELAIDE,Office (former Our Boys Institute Building) [facade only],S,State,,,,Adelaide,10890,,1325,H0201325,14040,Secondary School/College,H,high level confidence,SHB,,,,,B,Building footprint,ADELAIDE,,,CT 5799/369 F181570 A728,0207110012,ADELAIDE Council,,REG,24/07/1980,,"The former Our Boys Institute building is of heritage significance because of its association with the Our Boys Institute movement. Modelled on and supported by the Adelaide Branch of the YMCA, the OBI fostered the physical and mental health of 13 to 18"
263937,26338,Victoria Square ADELAIDE,,Victoria Square,,,ADELAIDE,Captain Charles Sturt Monument,S,State,,,,Adelaide,26396,,2404,H0202404,32240,Monument - Column - Cairn - Cross - Shrine - Marker - Statue,H,high level confidence,SHB,,,,,B,Building footprint,ADELAIDE,,A E G,CR 5779/247 F218073 A115,,ADELAIDE Council,,REG,8/03/2013,,The monument to Captain Charles Sturt is of heritage value as a memorial to a significant colonist who completed some of the most noteworthy explorations in Australia and was an important South Australian public administrator. The fact that it was funded
263775,26252,Victoria Square ADELAIDE,,Victoria Square,,,ADELAIDE,John Dowie's Three Rivers Fountain,S,State,,,,Adelaide,26375,,2397,H0202397,44000,General Inland Water Features,H,high level confidence,SHB,,,,,D,"item has been digitised (generally because it doesn't exist in a DCDB parcel, eg. bridge",ADELAIDE,,E G,CR 5779/247 F218073 A117,,,,REG,9/03/2012,,"The Three Rivers Fountains is of heritage significance because it demonstrates a high degree of creative, aesthetic and technical accomplishment, and because it was produced as a major work by a South Australian sculptor (John Dowie) of national standing"
263939,26340,Victoria Square ADELAIDE,,Victoria Square,,,ADELAIDE,Charles Cameron Kingston Monument,S,State,,,,Adelaide,26398,,2406,H0202406,32240,Monument - Column - Cairn - Cross - Shrine - Marker - Statue,H,high level confidence,SHB,,,,,B,Building footprint,ADELAIDE,,A E G,CR 5779/247 F218073 A117,,ADELAIDE Council,,REG,8/03/2013,,"The Monument to Charles Cameron Kingston commemorates the work and achievements of a significant South Australian, particularly Kingston's contribution to the formation of a federate Australia and his influence in drafting the Constitution of Australia."
244355,1283,27 Currie Street ADELAIDE,27,Currie Street,,,ADELAIDE,Elder House Offices,S,State,,,,Adelaide,11655,,1216,H0201216,11510,Business House - Offices,H,high level confidence,SHB,,,,,B,Building footprint,ADELAIDE,,,"CT 6130/116 F181406 A564,CT 6130/118 F181405 A563",0200887005,ADELAIDE Council,,REG,5/04/1984,,"Built in 1937-1940, Elder House is of high historical significance for its long association with one of South Australia's most successful business houses, and the prominent families that established and expanded the Company over three generations. It has"
244354,1283,27 Currie Street ADELAIDE,27,Currie Street,,,ADELAIDE,Elder House Offices,S,State,,,,Adelaide,11655,,1216,H0201216,11510,Business House - Offices,H,high level confidence,SHB,,,,,B,Building footprint,ADELAIDE,,,"CT 6130/116 F181406 A564,CT 6130/118 F181405 A563",0200887005,ADELAIDE Council,,REG,5/04/1984,,"Built in 1937-1940, Elder House is of high historical significance for its long association with one of South Australia's most successful business houses, and the prominent families that established and expanded the Company over three generations. It has"
246128,1299,141 King William Street ADELAIDE,141,King William Street,,,ADELAIDE,"Adelaide General Post Office (GPO), including the original 1872 building, remaining 1893 extensions, former Telephone Exchange (1907) and its 1914 extension",S,State,,,,Adelaide,10860,,1234,H0201234,11510,Business House - Offices,L,low level confidence,SHB,,,,,B,Building footprint,ADELAIDE,,,"CT 6084/525 D86151 A807,CT 6091/763 D86151 A801,CT 6122/319 D86151 A800","0201310005, 0201311008",ADELAIDE Council,,REG,24/07/1980,,"Opened in 1872, the Adelaide GPO was one of South Australia's most important public buildings, and represents the critical role played by postal, telegraphic and telephonic communications in the development of the state.

The scale and impressive archite"
246121,1299,141 King William Street ADELAIDE,141,King William Street,,,ADELAIDE,"Adelaide General Post Office (GPO), including the original 1872 building, remaining 1893 extensions, former Telephone Exchange (1907) and its 1914 extension",S,State,,,,Adelaide,10860,,1234,H0201234,11510,Business House - Offices,L,low level confidence,SHB,,,,,B,Building footprint,ADELAIDE,,,"CT 6084/525 D86151 A807,CT 6091/763 D86151 A801,CT 6122/319 D86151 A800","0201310005, 0201311008",ADELAIDE Council,,REG,24/07/1980,,"Opened in 1872, the Adelaide GPO was one of South Australia's most important public buildings, and represents the critical role played by postal, telegraphic and telephonic communications in the development of the state.

The scale and impressive archite"
246151,1324,65-69 Flinders Street ADELAIDE,65-69,Flinders Street,,,ADELAIDE,Baptist Church Office - former Manse,S,State,,,,Adelaide,10801,,1260,H0201260,15500,Religious Building,H,high level confidence,SHB,,,,,B,Building footprint,ADELAIDE,,A E,CT 5461/420 F18084 A51,0205470006,ADELAIDE Council,,REG,11/12/1997,,"Flinders Street Baptist Church was completed in 1863 and is a State Heritage Place. Mead Hall was erected in 1867/70, and the manse in 1877.  The Church, the hall and the manse form an impressive group of ecclesiastical buildings, the integrity of which"
244203,1338,301-307 North Terrace ADELAIDE,301-307,North Terrace,,,ADELAIDE,Dwelling ('Botanic Chambers'),S,State,,,,Adelaide,10848,,1282,H0201282,14560,Law Courts,H,high level confidence,SHB,,,,,B,Building footprint,ADELAIDE,,,"CT 5614/736 S6255 U1,CT 5614/737 S6255 U2,CT 5614/738 S6255 U3,CT 5614/739 S6255 U4,CT 5614/740 S6255 UCP,CT 5614/743 S6495 U2,CT 5614/745 S6495 U3,CT 5614/744 S6495 U4,CT 5614/746 S6495 UCP,CT 5614/742 S6495 U1,CT 5616/533 S6496 U1,CT 5616/534 S6496 U2,","0203386441, 0203386564,0203386572,0203386580,0203386599,0203386601,0203387006,0203387057,0203387102,0203387153,0203387209,020338725*,0203387305,0203387356,0203387401",ADELAIDE Council,,REG,26/11/1981,,"The Botanic Chambers, along with the associated Botanic Hotel, have very high architectural significance both for their form and style, and for their connection with the Architect, Michael McMullen of whose work they are perhaps the best surviving exampl"
244202,1338,301-307 North Terrace ADELAIDE,301-307,North Terrace,,,ADELAIDE,Dwelling ('Botanic Chambers'),S,State,,,,Adelaide,10848,,1282,H0201282,14560,Law Courts,H,high level confidence,SHB,,,,,B,Building footprint,ADELAIDE,,,"CT 5614/736 S6255 U1,CT 5614/737 S6255 U2,CT 5614/738 S6255 U3,CT 5614/739 S6255 U4,CT 5614/740 S6255 UCP,CT 5614/743 S6495 U2,CT 5614/745 S6495 U3,CT 5614/744 S6495 U4,CT 5614/746 S6495 UCP,CT 5614/742 S6495 U1,CT 5616/533 S6496 U1,CT 5616/534 S6496 U2,","0203386441, 0203386564,0203386572,0203386580,0203386599,0203386601,0203387006,0203387057,0203387102,0203387153,0203387209,020338725*,0203387305,0203387356,0203387401",ADELAIDE Council,,REG,26/11/1981,,"The Botanic Chambers, along with the associated Botanic Hotel, have very high architectural significance both for their form and style, and for their connection with the Architect, Michael McMullen of whose work they are perhaps the best surviving exampl"
244200,1338,301-307 North Terrace ADELAIDE,301-307,North Terrace,,,ADELAIDE,Dwelling ('Botanic Chambers'),S,State,,,,Adelaide,10848,,1282,H0201282,14560,Law Courts,H,high level confidence,SHB,,,,,B,Building footprint,ADELAIDE,,,"CT 5614/736 S6255 U1,CT 5614/737 S6255 U2,CT 5614/738 S6255 U3,CT 5614/739 S6255 U4,CT 5614/740 S6255 UCP,CT 5614/743 S6495 U2,CT 5614/745 S6495 U3,CT 5614/744 S6495 U4,CT 5614/746 S6495 UCP,CT 5614/742 S6495 U1,CT 5616/533 S6496 U1,CT 5616/534 S6496 U2,","0203386441, 0203386564,0203386572,0203386580,0203386599,0203386601,0203387006,0203387057,0203387102,0203387153,0203387209,020338725*,0203387305,0203387356,0203387401",ADELAIDE Council,,REG,26/11/1981,,"The Botanic Chambers, along with the associated Botanic Hotel, have very high architectural significance both for their form and style, and for their connection with the Architect, Michael McMullen of whose work they are perhaps the best surviving exampl"
244199,1338,301-307 North Terrace ADELAIDE,301-307,North Terrace,,,ADELAIDE,Dwelling ('Botanic Chambers'),S,State,,,,Adelaide,10848,,1282,H0201282,14560,Law Courts,H,high level confidence,SHB,,,,,B,Building footprint,ADELAIDE,,,"CT 5614/736 S6255 U1,CT 5614/737 S6255 U2,CT 5614/738 S6255 U3,CT 5614/739 S6255 U4,CT 5614/740 S6255 UCP,CT 5614/743 S6495 U2,CT 5614/745 S6495 U3,CT 5614/744 S6495 U4,CT 5614/746 S6495 UCP,CT 5614/742 S6495 U1,CT 5616/533 S6496 U1,CT 5616/534 S6496 U2,","0203386441, 0203386564,0203386572,0203386580,0203386599,0203386601,0203387006,0203387057,0203387102,0203387153,0203387209,020338725*,0203387305,0203387356,0203387401",ADELAIDE Council,,REG,26/11/1981,,"The Botanic Chambers, along with the associated Botanic Hotel, have very high architectural significance both for their form and style, and for their connection with the Architect, Michael McMullen of whose work they are perhaps the best surviving exampl"
244198,1338,301-307 North Terrace ADELAIDE,301-307,North Terrace,,,ADELAIDE,Dwelling ('Botanic Chambers'),S,State,,,,Adelaide,10848,,1282,H0201282,14560,Law Courts,H,high level confidence,SHB,,,,,B,Building footprint,ADELAIDE,,,"CT 5614/736 S6255 U1,CT 5614/737 S6255 U2,CT 5614/738 S6255 U3,CT 5614/739 S6255 U4,CT 5614/740 S6255 UCP,CT 5614/743 S6495 U2,CT 5614/745 S6495 U3,CT 5614/744 S6495 U4,CT 5614/746 S6495 UCP,CT 5614/742 S6495 U1,CT 5616/533 S6496 U1,CT 5616/534 S6496 U2,","0203386441, 0203386564,0203386572,0203386580,0203386599,0203386601,0203387006,0203387057,0203387102,0203387153,0203387209,020338725*,0203387305,0203387356,0203387401",ADELAIDE Council,,REG,26/11/1981,,"The Botanic Chambers, along with the associated Botanic Hotel, have very high architectural significance both for their form and style, and for their connection with the Architect, Michael McMullen of whose work they are perhaps the best surviving exampl"
244197,1338,301-307 North Terrace ADELAIDE,301-307,North Terrace,,,ADELAIDE,Dwelling ('Botanic Chambers'),S,State,,,,Adelaide,10848,,1282,H0201282,14560,Law Courts,H,high level confidence,SHB,,,,,B,Building footprint,ADELAIDE,,,"CT 5614/736 S6255 U1,CT 5614/737 S6255 U2,CT 5614/738 S6255 U3,CT 5614/739 S6255 U4,CT 5614/740 S6255 UCP,CT 5614/743 S6495 U2,CT 5614/745 S6495 U3,CT 5614/744 S6495 U4,CT 5614/746 S6495 UCP,CT 5614/742 S6495 U1,CT 5616/533 S6496 U1,CT 5616/534 S6496 U2,","0203386441, 0203386564,0203386572,0203386580,0203386599,0203386601,0203387006,0203387057,0203387102,0203387153,0203387209,020338725*,0203387305,0203387356,0203387401",ADELAIDE Council,,REG,26/11/1981,,"The Botanic Chambers, along with the associated Botanic Hotel, have very high architectural significance both for their form and style, and for their connection with the Architect, Michael McMullen of whose work they are perhaps the best surviving exampl"
263776,26253,Victoria Square ADELAIDE,,Victoria Square,,,ADELAIDE,Statue of Queen Victoria,S,State,,,,Adelaide,26388,,2398,H0202398,32240,Monument - Column - Cairn - Cross - Shrine - Marker - Statue,H,high level confidence,SHB,,,,,,,ADELAIDE,,E G,CT 0000/0000,,,,REG,9/03/2012,,"The statue of Queen Victoria is a place of State heritage significance. It demonstrates a high degree of creative and technical accomplishment, and is intrinsically related to the heritage of Tarndanyangga/Victoria Square, and the City of Adelaide. The c"
244236,1261,21-23 King William Street ADELAIDE,21-23,King William Street,,,ADELAIDE,Office (former AMP [Australian Mutual Provident Society] Building),S,State,,,,Adelaide,11574,,1175,H0201175,11510,Business House - Offices,H,high level confidence,SHB,,,,,B,Building footprint,ADELAIDE,,,"CT 5975/193 C23717 L103,CT 5975/194 C23717 L105,CT 5975/195 C23717 L106,CT 5975/196 C23717 L107,CT 5975/199 C23717 L201,CT 5975/200 C23717 L202,CT 5975/201 C23717 L203,CT 5975/202 C23717 L205,CT 5975/203 C23717 L206,CT 5975/204 C23717 L207,CT 5975/205 C2","0200128076, 0200128084,0200128092,0200128105,0200128113,0200128121,020012813*,0200128148,0200128156,0200128164,0200128172,0200128180,0200128199,0200128201,020012821*,0200128228,0200128236,0200128244,0200128252,0200128260,0200128279,0200128287,0200128295,",ADELAIDE Council,,REG,11/09/1986,,"The former Australian Mutual Provident Society Building is representative of the development and continued rise in the importance of insurance and financial institutions in South Australia, and in particular, the Australian Mutual Provident Society. Comp"
244208,1269,237 North Terrace ADELAIDE,237,North Terrace,,,ADELAIDE,"Scots (originally Chalmers' Free) Church [Uniting, former Free Presbyterian Church]",S,State,,,,Adelaide,13370,,1184,H0201184,15500,Religious Building,H,high level confidence,SHB,,,,,B,Building footprint,ADELAIDE,,,CT 5657/396 F181869 A217,0203304506,ADELAIDE Council,,REG,11/09/1986,,"Scots Church was built in 1850-51 and the spire was added in 1856. Originally known as Chalmers' Free Church, it is significant for being one of the Colony's major Free Presbyterian churches and is one of the grandest of those that have survived. 

It is"
